{
  "schema_version": "rules-residue.m2.m2-b001-recovery-closeout/1.0",
  "evidence_id": "M2-B001-RECOVERY-CLOSEOUT-001-E002",
  "task_id": "RULES-RESIDUE-M2-B001-RECOVERY-CLOSEOUT-IMPLEMENT-002",
  "closeout_id": "M2-B001-RECOVERY-CLOSEOUT-001",
  "attempt_number": 2,
  "nature": "ADDITIVE_RECOVERY_CLOSEOUT_EVIDENCE_CANDIDATE",
  "source_binding": {
    "commit": "be1f8dca3c694c9b93a3193348772ae750fc77e1",
    "tree": "e4ad6e4f5ad4f672c827b1f37c1980b7655353d6"
  },
  "route_binding": {
    "route_id": "M2-B001-RECOVERY-CLOSEOUT-IMPLEMENT-002",
    "mode": "IMPLEMENT",
    "milestone": "M2",
    "batch_id": "M2-B001",
    "source_commit": "be1f8dca3c694c9b93a3193348772ae750fc77e1",
    "source_tree": "e4ad6e4f5ad4f672c827b1f37c1980b7655353d6",
    "binding_digest": "f4b61ceab917a056ce392318319635c74b54a9375bb8ea0e78f2b67c1dc33cc6",
    "owner_package_id": "RR-M2-B001-RECOVERY-ATTEMPT-002-V1",
    "owner_manifest_sha256": "dff66863f19d85f5f22f2453181f14c0c5ce484c8825a15ee7a95b7e0ea38989"
  },
  "formal_m2_b001": {
    "status": "ACCEPTED_UNCHANGED",
    "commit": "fdc1f4c9d8bc565888f33b44684cd6ccbe80c127",
    "tree": "f37e15cdd65e0a39eebcddb21f56a2c58ae6939e",
    "result_path": "reports/m2/probes/probe-results.json",
    "result_sha256": "154e7c0ddf8ce7b2243ad6c78d10ceb6cddf02c3aeb6592716dcc5ad8fc64218"
  },
  "historical_projection": {
    "R2-INT-010": "FAIL",
    "source_path": "reports/m2/probes/probe-results.json",
    "source_sha256": "154e7c0ddf8ce7b2243ad6c78d10ceb6cddf02c3aeb6592716dcc5ad8fc64218"
  },
  "effective_projection": {
    "R2-INT-010": "RESOLVED_ADAPTER",
    "transition_path": "reports/m2/probes/remediations/r2-int-010-post-platform-transition/evidence.json",
    "transition_sha256": "f2e9c48517cd9437aa464041f28b15e8ff96c8df8533c58fa8afb001d22fdd18"
  },
  "accepted_post_platform_pair": {
    "rules": {
      "commit": "455cd5d66c683565a4aad7ef8d6523421d37db71",
      "tree": "d74aae0baf791566a770ef1aaed2da7562f681d5"
    },
    "platform": {
      "commit": "1339c490bd8cae1e2a6e6607fc0f1db019faab64",
      "tree": "25d5645caf883a73f165db0179accbca48ddf526"
    },
    "verdict": "PASS_EXACT_PAIR_CROSS_REPOSITORY_ACCEPTED",
    "verdict_sha256": "099aaa7244b4a443e31bcdb733bbef2728de11b5129382328b4274ffe2534185"
  },
  "rules_transition": {
    "commit": "be1f8dca3c694c9b93a3193348772ae750fc77e1",
    "tree": "e4ad6e4f5ad4f672c827b1f37c1980b7655353d6",
    "status": "RESOLVED_ADAPTER"
  },
  "platform_closeout": {
    "commit": "cde53640e143b7adb9e36d7d8bc4fedb6f0ed401",
    "tree": "52ddf06463b01b1e0c5532af3796d4592d4ddea8",
    "batch_id": "M1-B010",
    "state": "COMPLETED",
    "active_implementation_wip": "NONE"
  },
  "prior_attempts": [
    {
      "task_id": "RULES-RESIDUE-M2-B001-RECOVERY-CLOSEOUT-IMPLEMENT-001",
      "commit": "854b43980f0633a4b2e01e61d326d7526cb11c8e",
      "tree": "411565bc632e24806f67e39d9c6100d0cdb321f9",
      "disposition": "QUARANTINED_UNACCEPTED_LOCAL_CANDIDATE"
    }
  ],
  "non_authoritative_antecedents": [
    {
      "identity": "c6a840b10db46dc475cd9af9e6a1a13f1e68abd4",
      "category": "PRE_PLATFORM_RULES_COMMIT",
      "disposition": "PRE_PLATFORM_PROVISIONAL_NOT_ACCEPTED",
      "may_be_used_as_execution_evidence": false
    },
    {
      "identity": "65a0a1671720345425e0368136793754567187cc",
      "category": "PRE_PLATFORM_RULES_COMMIT",
      "disposition": "PRE_PLATFORM_PROVISIONAL_NOT_ACCEPTED",
      "may_be_used_as_execution_evidence": false
    },
    {
      "identity": "PLATFORM_CHANGE_PROPOSAL",
      "category": "PROPOSAL",
      "disposition": "ANTECEDENT_ONLY_NOT_EXECUTION_EVIDENCE",
      "may_be_used_as_execution_evidence": false
    },
    {
      "identity": "OWNER_APPROVAL_ANTECEDENT",
      "category": "OWNER_APPROVAL",
      "disposition": "ANTECEDENT_ONLY_NOT_EXECUTION_EVIDENCE",
      "may_be_used_as_execution_evidence": false
    },
    {
      "identity": "EARLY_PHASE_J",
      "category": "PRE_PLATFORM_EXECUTION",
      "disposition": "PRE_PLATFORM_PROVISIONAL_NOT_ACCEPTED",
      "may_be_used_as_execution_evidence": false
    },
    {
      "identity": "ATTEMPT_001",
      "category": "QUARANTINED_CANDIDATE",
      "disposition": "QUARANTINED_UNACCEPTED_LOCAL_CANDIDATE",
      "may_be_used_as_execution_evidence": false
    },
    {
      "identity": "OWNER_ROUTE_AUTHORITY",
      "category": "ROUTING_PROJECTION",
      "disposition": "ROUTING_ONLY_NON_AUTHORITATIVE_PROJECTION",
      "may_be_used_as_execution_evidence": false
    }
  ],
  "non_claims": {
    "formal_B002": false,
    "formal_B009": false,
    "aggregate_M2_pass": false,
    "aggregate_external_capability_pass": false
  },
  "readiness": {
    "M2-B002": "NOT_STARTED",
    "M2-B002_READY": "NO",
    "blocking_ids": [
      "R2-INT-011",
      "R2-INT-012",
      "DEFER-R2-C14-001"
    ]
  },
  "lifecycle": {
    "candidate_state": "FROZEN_WITH_RECOVERY_EVIDENCE_PENDING_LIFECYCLE_CLOSEOUT",
    "lifecycle_closeout_executed": false,
    "independent_acceptance": "NOT_RUN"
  },
  "candidate_binding": {
    "strategy": "EXACT_HEAD_AT_VALIDATION",
    "execution_status": "NOT_RUN",
    "required_phase": "INDEPENDENT_ACCEPT",
    "must_bind_exact_commit_tree": true,
    "clean_worktree_required": true
  },
  "evidence_links": {
    "execution_records": "reports/m2/probes/closeouts/m2-b001-recovery-closeout-001/execution-records.json",
    "evidence_manifest": "reports/m2/probes/closeouts/m2-b001-recovery-closeout-001/evidence-manifest.json",
    "external_evidence_index_v2": "reports/m2/probes/external-evidence-index-v2.json"
  }
}
